{
    "$schema": "./deviation_rules.schema.json",
    "earnie_data_model": 4,
    "version": 1,
    "tolerances": {
        "power_kw": 0.1,
        "soc_percent": 0.1
    },
    "categories": {
        "hint": {
            "label": "Hinweis",
            "symbol": "triangle-up",
            "color": "#27ae60"
        },
        "warning": {
            "label": "Warnung",
            "symbol": "diamond",
            "color": "#f1c40f"
        },
        "error": {
            "label": "Fehler",
            "symbol": "octagon",
            "color": "#c0392b"
        }
    },
    "rules": [
        {
            "id": "swimspa_thermal_band_ok",
            "enabled": true,
            "category": "warning",
            "priority": 100,
            "scope": "swimspa",
            "when": [
                "power_mismatch_positive",
                "thermal_actual_in_band",
                "heating_was_scheduled"
            ],
            "message": "SwimSpa nicht geheizt — Ist-Temperatur im Sollband"
        },
        {
            "id": "eauto_pv_follow_missing",
            "enabled": true,
            "category": "error",
            "priority": 60,
            "scope": "eauto",
            "when": [
                "pv_follow_scheduled",
                "pv_follow_power_below_tolerance"
            ],
            "message": "PV-Überschuss-Modus: Soll {soll_kw:.2f} kW, Ist {ist_kw:.2f} kW"
        },
        {
            "id": "eauto_should_charge",
            "enabled": true,
            "category": "error",
            "priority": 50,
            "scope": "eauto",
            "when": [
                "power_mismatch_positive",
                "plugged_in",
                "remaining_kwh_above_threshold"
            ],
            "params": {
                "remaining_kwh_threshold": 0.5
            },
            "message": "E-Auto: Soll {soll_kw:.2f} kW, Ist {ist_kw:.2f} kW"
        },
        {
            "id": "battery_forced_discharge_missing",
            "enabled": true,
            "category": "error",
            "priority": 75,
            "scope": "battery",
            "when": [
                "mode_is_forced_discharge",
                "battery_power_below_tolerance"
            ],
            "message": "Zwangs-Entladen nicht ausgeführt"
        },
        {
            "id": "battery_forced_charge_missing",
            "enabled": true,
            "category": "error",
            "priority": 80,
            "scope": "battery",
            "when": [
                "mode_is_forced_charge",
                "battery_charge_energy_below_ratio"
            ],
            "message": "Zwangs-Laden: Zielenergie deutlich verfehlt ({ratio_pct:.0f} %, Soll {soll_kwh:.2f} kWh, Ist {ist_kwh:.2f} kWh)",
            "params": {
                "max_ratio": 0.6,
                "min_shortfall_kwh": 0.1
            }
        },
        {
            "id": "battery_forced_charge_target_missed",
            "enabled": true,
            "category": "warning",
            "priority": 78,
            "scope": "battery",
            "when": [
                "mode_is_forced_charge",
                "battery_charge_energy_below_ratio"
            ],
            "params": {
                "max_ratio": 0.8,
                "min_shortfall_kwh": 0.1
            },
            "message": "Zwangs-Laden: Zielenergie nicht erreicht ({ratio_pct:.0f} %, Soll {soll_kwh:.2f} kWh, Ist {ist_kwh:.2f} kWh)"
        },
        {
            "id": "waermepumpe_enable_no_start",
            "enabled": true,
            "category": "hint",
            "priority": 40,
            "scope": "waermepumpe",
            "when": [
                "power_energy_below_ratio"
            ],
            "message": "Wärmepumpe: Freigabe, aber nicht angesprungen ({ratio_pct:.0f} %, Soll {soll_kwh:.2f} kWh, Ist {ist_kwh:.2f} kWh)",
            "params": {
                "max_ratio": 0.5,
                "min_shortfall_kwh": 0.1
            }
        },
        {
            "id": "swimspa_filter_should_run_missing",
            "enabled": true,
            "category": "error",
            "priority": 55,
            "scope": "pool_filter",
            "when": [
                "power_mismatch_positive"
            ],
            "message": "SwimSpa Filter läuft nicht trotz Freigabe (Soll {soll_kw:.2f} kW, Ist {ist_kw:.2f} kW)"
        },
        {
            "id": "swimspa_filter_runs_unexpectedly",
            "enabled": true,
            "category": "error",
            "priority": 52,
            "scope": "pool_filter",
            "when": [
                "power_ist_without_soll",
                "slot_outside_native_filter_window"
            ],
            "message": "SwimSpa Filter läuft ohne Freigabe außerhalb nativem Fenster (Ist {ist_kw:.2f} kW)"
        },
        {
            "id": "swimspa_filter_over_nominal",
            "enabled": true,
            "category": "warning",
            "priority": 45,
            "scope": "pool_filter",
            "when": [
                "ist_power_above_nominal"
            ],
            "message": "SwimSpa Filter zieht mehr als Nennleistung (Ist {ist_kw:.2f} kW)"
        }
    ],
    "fallback": {
        "on_unclassified_mismatch": "none"
    }
}
